titulo	numero_expediente	tipo_contrato	estado_licitacion	importe_licitacion	valor_estimado_contrato	fecha_limite_presentacion	organo_contratacion	enlace	codigo_cpv	procedimiento_contratacion	forma_presentacion	duracion_contrato	financiacion_ue	fecha_formalizacion	lugar_ejecucion	sistema_contratacion	tramitacion	descripcion	pdf	fuente	fecha_proceso	topicos_lda	clasificacion	palabras_tecnologicas_detectadas	palabras_descartadas_detectadas
SUBASTA, ENAJENACIÓN DE ASTILLA PROCEDENTES DE ACTUACIONES EN EL PLAN DE GESTIÓN INTEGRAL DE LOS MONTES PÚBLICOS DE EL MUSTIO EN LA PROVINCIA DE HUELVA. AÑO 2025. COMUNIDAD AUTÓNOMA DE ANDALUCÍA.	DMAYS 20250924	Patrimoniales	Publicada	28315.3	28315.3	2025-10-10	Agencia de Medio Ambiente y Agua de Andalucía	https://www.juntadeandalucia.es/haciendayadministracionpublica/apl/pdc-front-publico/perfiles-licitaciones/detalle-licitacion?idExpediente=841907	03410000-7 Madera	Abierto	Electrónica	Ver lotes	NotFound	2100-12-31	(código NUTS) ES615 - HuelvaHuelva	NotFound	Ordinario	SUBASTA, ENAJENACIÓN DE ASTILLA PROCEDENTES DE ACTUACIONES EN EL PLAN DE GESTIÓN INTEGRAL DE LOS MONTES PÚBLICOS DE EL MUSTIO EN LA PROVINCIA DE HUELVA. AÑO 2025. COMUNIDAD AUTÓNOMA DE ANDALUCÍA.	and_pliego_prescripciones_336402.pdf	Andalucía	2025-09-29	gestion, monte, integral, documento, firmado, publico, verificacion, mustio, codigo, direccion (1.0)	N/S		
OBRAS VÍA CICLISTA Y PEATONAL ALHENDÍN	CONTR 2025 0000492810	Obras	Publicada	1056828.18	1268193.82	2025-10-17	Delegación Territorial de Fomento, Articulación del Territorio y Vivienda en Granada	https://www.juntadeandalucia.es/haciendayadministracionpublica/apl/pdc-front-publico/perfiles-licitaciones/detalle-licitacion?idExpediente=845314	45220000-5 Obras de ingeniería y trabajos de construcción45233162-2 Trabajos de construcción de pistas para bicicletas	Abierto	Electrónica	6 meses	NotFound	2100-12-31	(código NUTS) ES614 - GranadaGranada	NotFound	Ordinario	EJECUCIÓN DE LAS OBRAS DEL ¿PROYECTO DE CONSTRUCCIÓN DE ¿VÍA CICLISTA Y PEATONAL EN EL RECORRIDO GR-12: ARMILLA-ALHENDÍN, EN LA PROVINCIA DE GRANADA¿.	and_pliego_prescripciones_337020.pdf	Andalucía	2025-09-29	expediente, pliego, obra, particular, tecnica, costar, constar, granada, proyecto, prescripción (1.0)	No tecnológica		infraestructura
NUEVA CONEXIÓN SUR POLÍGONO INDUSTRIAL ALBOX CON ENLACE OESTE A-334. ALBOX	CONTR 2025 0000589787	Obras	Publicada	764273.86	764273.86	2025-10-16	Delegación Territorial de Fomento, Articulación del Territorio y Vivienda en Almería	https://www.juntadeandalucia.es/haciendayadministracionpublica/apl/pdc-front-publico/perfiles-licitaciones/detalle-licitacion?idExpediente=845316	45233120-6 Trabajos de construcción de carreteras	Abierto simplificado	Electrónica	3 meses	NotFound	2100-12-31	(código NUTS) ES611 - AlmeríaAlmería	NotFound	Urgencia	NUEVA CONEXIÓN SUR DEL POLÍGONO INDUSTRIAL DE ALBOX CON EL ENLACE OESTE DE ALBOX DE LA AUTOVÍA A-334. T.M. ALBOX (ALMERÍA)	and_pliego_prescripciones_337027.pdf	Andalucía	2025-09-29	javier, francisco, verificacion, conchillo, fernandez, pagina, paginar, material, transporte, carga (1.0)	N/S		
ACUERDO MARCO DE CIBERSEGURIDAD	CH000-25-001.	Suministros	Publicada	1192706.8	1769634.72	2025-10-02	Verificaciones Industriales de Andalucía, S.A. (VEIASA)	https://www.juntadeandalucia.es/haciendayadministracionpublica/apl/pdc-front-publico/perfiles-licitaciones/detalle-licitacion?idExpediente=837800	32500000-8 Equipo y material para telecomunicaciones48218000-9 Paquetes de software de gestión de licencias48732000-8 Paquetes de software de seguridad de datos72000000-5 Servicios TI: consultoría, desarrollo de software, Internet y apoyo72150000-1 Servicios de consultoría en auditoría informática y en equipo informático72250000-2 Servicios de sistemas y apoyo72600000-6 Servicios de apoyo informático y de consultoría72800000-8 Servicios de ensayo y auditoría informáticos72810000-1 Servicios de auditoría informática79132000-8 Servicios de certificación80330000-6 Servicios de enseñanza en temas de seguridad80510000-2 Servicios de formación especializada80521000-2 Servicios de programación de la formación80531200-7 Servicios de formación técnica80550000-4 Servicios de formación en materia de seguridad80590000-6 Servicios de tutoría	Abierto	Electrónica	Ver lotes	NotFound	2100-12-31	(código NUTS) ES61 - AndalucíaCórdobaSevillaMálagaGranadaCádizAlmeríaHuelvaJaén	Acuerdo marco	Ordinario	ACUERDO MARCO DE CIBERSEGURIDAD	and_pliego_prescripciones_326690.pdf	Andalucía	2025-09-29	seguridad, servicio, veiasar, trabajo, sistema, equipo, proyecto, incidente, poder, nivel (1.0)	Tecnológica	software, tecnologia, analitica, inteligencia_artificial, servidores, nube, ciberseguridad, redes, automatizacion	reparacion, infraestructura, eventos, seguro
"ACUERDO MARCO CON UNA ÚNICA EMPRESA, PARA EL SUMINISTRO DE MATERIAL ESPECIFICO PARA QUIRÓFANO: (PSU.PC.SANI.01.11) FUNDAS, BOLSAS, HIGIENE Y, GUANTES QUIRÚRGICOS. CON DISPONIBILIDAD DE USO DEL EQUIPAMIENTO NECESARIO PARA LA UTILIZACIÓN DEL
MATERIAL PARA LOS CENTROS INTEGRANTES DE LA CENTRAL PROVINCIAL DE COMPRAS DE ALMERÍA. POR PRECIO UNITARIO AL AMPARO DEL ART 16.3 LCSP, PROCEDIMIENTO ABIERTO. SUJETO A REGULACIÓN ARMONIZA Y PRESENTACIÓN ELECTRÓNICA DE OFERTAS  EXPEDIENTE 000496/2025 CCA: +6.I6XTI9L Nº GIRO: CONTR 2025 0000505291"	CONTR 2025 0000505291	Suministros	Publicada	1548822.94	3407410.47	2025-10-03	Servicio Andaluz de Salud	https://www.juntadeandalucia.es/haciendayadministracionpublica/apl/pdc-front-publico/perfiles-licitaciones/detalle-licitacion?idExpediente=838119	33141000-0 Productos consumibles médicos no químicos desechables y productos consumibles hematológicos39224200-0 Cepillos	Abierto	Electrónica	Ver lotes	NotFound	2100-12-31	(código NUTS) ES611 - AlmeríaAlmería	Acuerdo marco	Ordinario	"ACUERDO MARCO CON UNA ÚNICA EMPRESA, PARA EL SUMINISTRO DE MATERIAL ESPECIFICO PARA QUIRÓFANO: (PSU.PC.SANI.01.11) FUNDAS, BOLSAS, HIGIENE Y, GUANTES QUIRÚRGICOS. CON DISPONIBILIDAD DE USO DEL EQUIPAMIENTO NECESARIO PARA LA UTILIZACIÓN DEL
MATERIAL PARA LOS CENTROS INTEGRANTES DE LA CENTRAL PROVINCIAL DE COMPRAS DE ALMERÍA. POR PRECIO UNITARIO AL AMPARO DEL ART 16.3 LCSP, PROCEDIMIENTO ABIERTO. SUJETO A REGULACIÓN ARMONIZA Y PRESENTACIÓN ELECTRÓNICA DE OFERTAS  EXPEDIENTE 000496/2025 CCA: +6.I6XTI9L Nº GIRO: CONTR 2025 0000505291"	and_pliego_prescripciones_327640.pdf	Andalucía	2025-09-29	Sin tema	N/S		
A.T OBRAS. PLATAFORMA RESERVADA (BUS-VAO) EN ALHAURÍN DE LA TORRE (MÁLAGA)	CONTR 2025 0000377006	Servicios	Publicada	476098.0	571317.6	2025-10-24	Consejería de Fomento, Articulación del Territorio y Vivienda. Secretaría General Técnica	https://www.juntadeandalucia.es/haciendayadministracionpublica/apl/pdc-front-publico/perfiles-licitaciones/detalle-licitacion?idExpediente=841537	71310000-4 Servicios de consultoría en ingeniería y construcción71520000-9 Servicios de supervisión de obras	Abierto	Electrónica	49 meses	NotFound	2100-12-31	(código NUTS) ES617 - MálagaMálaga	NotFound	Ordinario	ASISTENCIA TÉCNICA A LA DIRECCIÓN FACULTATIVA PARA CONTROL Y VIGILANCIA DE LAS OBRAS ¿PLATAFORMA RESERVADA DE LA A-404 (BUS-VAO) ENTRE LOS PUNTOS KILOMÉTRICOS 22+300 Y 24+600, EN ALHAURÍN DE LA TORRE (MÁLAGA).¿	and_pliego_prescripciones_337059.pdf	Andalucía	2025-09-29	obra, control, calidad, tecnico, ejecucion, contrato, asistencia, proyecto, unidad, facultativo (1.0)	Tecnológica	software, tecnologia	infraestructura, limpieza, mobiliario
AT DIR. FACULTATIVA OBRAS A-357 CASAPALMA-CERRALBA	CONTR 2025 0000435852	Servicios	Publicada	1252737.68	1503285.22	2025-10-24	Consejería de Fomento, Articulación del Territorio y Vivienda. Secretaría General Técnica	https://www.juntadeandalucia.es/haciendayadministracionpublica/apl/pdc-front-publico/perfiles-licitaciones/detalle-licitacion?idExpediente=841555	71310000-4 Servicios de consultoría en ingeniería y construcción71520000-9 Servicios de supervisión de obras	Abierto	Electrónica	58 meses	NotFound	2100-12-31	(código NUTS) ES617 - MálagaMálaga	NotFound	Ordinario	ASISTENCIA TÉCNICA A LA DIRECCIÓN FACULTATIVA PARA CONTROL Y VIGILANCIA DE LAS OBRAS AUTOVÍA A-357. TRAMO: ENLACE DE CASAPALMA - ENLACE DE CERRALBA. EJE RONDA ¿ MÁLAGA ¿ CAMPILLOS (MÁLAGA)	and_pliego_prescripciones_335761.pdf	Andalucía	2025-09-29	obra, control, calidad, tecnico, ejecucion, contrato, direccion, asistencia, proyecto, unidad (1.0)	Tecnológica	software, tecnologia	infraestructura, mobiliario
Servicio Experto Especializado para las Telecomunicaciones de la Junta de Andalucía	EXPT24-00132	Servicios	Publicada	4660076.33	14912244.26	2025-10-14	Sociedad Andaluza para el Desarrollo de las Telecomunicaciones, S.A. (SANDETEL)	https://www.juntadeandalucia.es/haciendayadministracionpublica/apl/pdc-front-publico/perfiles-licitaciones/detalle-licitacion?idExpediente=837298	72700000-7 Servicios de red informática	Abierto	Electrónica	18 meses	NotFound	2100-12-31	(código NUTS) ES61 - AndalucíaGranadaCádizHuelvaMálagaJaénSevillaAlmeríaCórdoba	NotFound	Ordinario	"Entre las principales actividades a desarrollar por la empresa adjudicataria, se encuentran (sin limitarse a):  
* Gestión y coordinación del proyecto.
* Resolución de reclamaciones y desbloqueos del servicio.
* Seguimiento y control de la calidad de los servicios entregados.
* Implementación de mejoras en los servicios de telecomunicaciones.
* Supervisión de infraestructuras generales (térmicas, acústicas, eléctricas, electromagnéticas).
* Gestión logística de materiales y equipos.
* Auditorías de planta interna y externa, estaciones base, y centros de datos.
* Verificación de cobertura y propuestas de mejora.
* Soporte técnico en campo a los usuarios.
* Certificación y verificación de instalaciones inalámbricas.
* Revisión de la documentación de proyectos financiados por fondos europeos.
* Análisis teóricos y mediciones de servicios móviles.
* Cumplimiento de las normativas aplicables al desarrollo del proyecto.
* Mantenimiento y soporte técnico en redes LAN, WIFI, DMR,"	and_pliego_prescripciones_324829.pdf	Andalucía	2025-09-29	servicio, documento, proyecto, campo, telecomunicación, empresa, sandetel, verificacion, codigo, tecnico (1.0)	Tecnológica	software, erp, tecnologia, redes, automatizacion	reparacion, infraestructura, limpieza, alimentacion, romeria, seguro
OBRA CENTRO DE CRÍA CERCETA PARDILLA ZOO BOTANICO	CONTR 2025 0000022022	Obras	Publicada	187435.04	187435.04	2025-10-06	Consejería de Sostenibilidad y Medio Ambiente. Dirección General de Política Forestal y Biodiversidad	https://www.juntadeandalucia.es/haciendayadministracionpublica/apl/pdc-front-publico/perfiles-licitaciones/detalle-licitacion?idExpediente=838626	45262420-1 Trabajos de montaje de piezas de acero para la construcción de estructuras90500000-2 Servicios relacionados con desperdicios y residuos90722000-4 Rehabilitación medioambiental	Abierto simplificado	Electrónica	2 meses	NotFound	2100-12-31	(código NUTS) ES612 - CádizCádiz	NotFound	Ordinario	OBRA CENTRO DE CRÍA DE CERCETA PARDILLA EN EL ZOOBOTÁNICO DE JEREZ CÁDIZ LIFE /9ANT CERCETA PARDILLA LIFE19 NAT/ES/000906, ACCIÓN C4	and_pliego_prescripciones_329222.pdf	Andalucía	2025-09-29	juan, biodiversidad, pliego, francisco, tecnica, carmonar, martinez, prescripción, obra, proyecto (0.9900000095367432)	N/S		
CCA: +6.C-Z87-N 0000879/2025 SUMINISTRO, INSTALACIÓN Y MANTENIMIENTO DE TRES RESPIRADORES NEONATALES PARA EL SERVICIO DE PEDIATRÍA DEL HOSPITAL UNIVERSITARIO REINA SOFÍA DE CÓRDOBA (PAS 51/25)	CONTR 2025 0000611288	Suministros	Publicada	130000.0	130000.0	2025-10-14	Servicio Andaluz de Salud	https://www.juntadeandalucia.es/haciendayadministracionpublica/apl/pdc-front-publico/perfiles-licitaciones/detalle-licitacion?idExpediente=845297	33100000-1 Equipamiento médico	Abierto simplificado	Electrónica	Ver lotes	NotFound	2100-12-31	(código NUTS) ES613 - CórdobaCórdoba	NotFound	Ordinario	SUMINISTRO, INSTALACIÓN Y MANTENIMIENTO DE TRES RESPIRADORES NEONATALES PARA EL SERVICIO DE PEDIATRÍA DEL HOSPITAL UNIVERSITARIO REINA SOFÍA DE CÓRDOBA (PAS 51/25)	and_pliego_prescripciones_336975.pdf	Andalucía	2025-09-29	sistema, adjudicatario, informacion, servicio, dato, seguridad, sticcor, deberar, necesario, gestion (1.0)	Tecnológica	software, tecnologia, datos, servidores, nube, ciberseguridad	infraestructura, alimentacion, seguro
0000910/2025 PAS 47/25 Suministro y montaje de mobiliario general para el Distrito Córdoba y Guadalquivir, nuevo Centro de Salud de El Naranjo-Mirabueno, Centro adscrito a la Central Provincial de Compras de Córdoba.	CONTR 2025 0000611582	Suministros	Publicada	51105.95	51105.95	2025-10-14	Servicio Andaluz de Salud	https://www.juntadeandalucia.es/haciendayadministracionpublica/apl/pdc-front-publico/perfiles-licitaciones/detalle-licitacion?idExpediente=845299	39100000-3 Mobiliario	Abierto simplificado	Electrónica	Ver lotes	NotFound	2100-12-31	(código NUTS) ES613 - CórdobaCórdoba	NotFound	Ordinario	PAS 47/25 Suministro y montaje de mobiliario general para el Distrito Córdoba y Guadalquivir, nuevo Centro de Salud de El Naranjo-Mirabueno, Centro adscrito a la Central Provincial de Compras de Córdoba.	and_pliego_prescripciones_336986.pdf	Andalucía	2025-09-29	mesa, madera, color, claro, respaldo, regulable, dimensión, alto, altura, sillon (1.0)	No tecnológica		rehabilitacion, mobiliario, vestuario
0000860/2025 SUMINISTRO E INSTALACION DE CINCO EQUIPOS DE MONITORIZACIÓN FISIOLÓGICA DE PACIENTES CON DESTINO A LAS UNIDADES DE CIRUGIA CARDIOVASCULAR Y NEFROLOGIA DEL HOSPITAL UNIVERSITARIO REINA SOFIA DE CÓRDOBA (PAS 54/25)	CONTR 2025 0000610608	Suministros	Publicada	30578.51	30578.51	2025-10-14	Servicio Andaluz de Salud	https://www.juntadeandalucia.es/haciendayadministracionpublica/apl/pdc-front-publico/perfiles-licitaciones/detalle-licitacion?idExpediente=845276	33100000-1 Equipamiento médico	Abierto simplificado	Electrónica	Ver lotes	NotFound	2100-12-31	(código NUTS) ES613 - CórdobaCórdoba	NotFound	Ordinario	SUMINISTRO E INSTALACION DE CINCO EQUIPOS DE MONITORIZACIÓN FISIOLÓGICA DE PACIENTES CON DESTINO A LAS UNIDADES DE CIRUGIA CARDIOVASCULAR Y NEFROLOGIA DEL HOSPITAL UNIVERSITARIO REINA SOFIA DE CÓRDOBA (PAS 54/25)	and_pliego_prescripciones_336947.pdf	Andalucía	2025-09-29	sistema, adjudicatario, informacion, servicio, dato, seguridad, sticcor, deberar, necesario, gestion (1.0)	Tecnológica	software, tecnologia, datos, servidores, nube, ciberseguridad	infraestructura, alimentacion, seguro
Servicio de limpieza de la sede Servicio de Comerico	CONTR 2025 0000323480	Servicios	Publicada	25140.61	50281.82	2025-10-01	Delegación Territorial de Empleo, Empresa y Trabajo Autónomo en Huelva	https://www.juntadeandalucia.es/haciendayadministracionpublica/apl/pdc-front-publico/perfiles-licitaciones/detalle-licitacion?idExpediente=839475	90911200-8 Servicios de limpieza de edificios	Abierto simplificado abreviado	Electrónica	12 meses	NotFound	2100-12-31	(código NUTS) ES615 - HuelvaHuelva	NotFound	Ordinario	Servicio de limpieza de la sede Servicio de Comerico	and_pliego_prescripciones_331667.pdf	Andalucía	2025-09-29	limpieza, servicio, adjudicatario, trabajo, huelva, personal, contrato, empresa, limpiezar, edificio (1.0)	Tecnológica	servidores	limpieza, desinfeccion, mobiliario
MANTENIMIENTO ACINIPO (RONDA)	CONTR 2025 0000425695	Servicios	Publicada	56828.13	113656.26	2025-09-29	Delegación Territorial de Turismo, Cultura y Deporte en Málaga	https://www.juntadeandalucia.es/haciendayadministracionpublica/apl/pdc-front-publico/perfiles-licitaciones/detalle-licitacion?idExpediente=839031	71351914-3 Servicios arqueológicos	Abierto simplificado	Electrónica	12 meses	NotFound	2100-12-31	(código NUTS) ES617 - MálagaMálaga	NotFound	Ordinario	MANTENIMIENTO RECORRIDO VISITA ENCLAVE ACINIPO (RONDA)	and_pliego_prescripciones_330434.pdf	Andalucía	2025-09-29	arqueologico, contrato, trabajo, servicio, zona, mantenimiento, enclave, acinipo, vegetacion, deberar (1.0)	Tecnológica	analitica, nube	reparacion, limpieza
CONTRATO PARA LA PRESTACIÓN DEL SERVICIO DE TAREAS DE IMPRESIÓN, PLEGADO, ENSOBRADO, CLASIFICADO Y DEPÓSITO EN CORREOS DE LAS CARTAS CON AVISOS DE CADUCIDAD ITV.	CT030-25-011	Servicios	Publicada	71764.53	71764.53	2025-10-14	Verificaciones Industriales de Andalucía, S.A. (VEIASA)	https://www.juntadeandalucia.es/haciendayadministracionpublica/apl/pdc-front-publico/perfiles-licitaciones/detalle-licitacion?idExpediente=840553	79571000-7 Servicios de envío por correo	Abierto simplificado	Electrónica	36 meses	NotFound	2100-12-31	(código NUTS) ES61 - AndalucíaAlmeríaJaénCórdobaGranadaSevillaHuelvaMálagaCádiz	NotFound	Ordinario	CONTRATO PARA LA PRESTACIÓN DEL SERVICIO DE TAREAS DE IMPRESIÓN, PLEGADO, ENSOBRADO, CLASIFICADO Y DEPÓSITO EN CORREOS DE LAS CARTAS CON AVISOS DE CADUCIDAD ITV.	and_pliego_prescripciones_333719.pdf	Andalucía	2025-09-29	servicio, veiasar, carta, dato, adjudicatario, contrato, inspeccion, itv, tecnico, pliego (1.0)	No tecnológica		infraestructura, seguro
SUMINISTRO VEHICULO SEMINUEVO MODALIDAD ADQUISICIÓN	CONTR 2025 0000545121	Suministros	Publicada	29501.13	29501.13	2025-10-10	Delegación Territorial de Turismo, Cultura y Deporte en Málaga	https://www.juntadeandalucia.es/haciendayadministracionpublica/apl/pdc-front-publico/perfiles-licitaciones/detalle-licitacion?idExpediente=845251	34100000-8 Vehículos de motor34115200-8 Vehículos de motor para el transporte de menos de diez personas	Abierto simplificado abreviado	Electrónica	15 días	NotFound	2100-12-31	(código NUTS) ES61 - AndalucíaHuelvaMálaga	NotFound	Urgencia	SUMINISTRO VEHICULO SEMINUEVO MODALIDAD ADQUISICIÓN	and_pliego_prescripciones_336882.pdf	Andalucía	2025-09-29	vehiculo, sistema, minimo, contrato, plazo, delantero, deber, deberar, motor, garantia (1.0)	Tecnológica	tecnologia	reparacion
SERV. TRAMITACIÓN, GESTIÓN, DEPÓSITO Y CUSTODIA DEL FONDO DOCUMENTAL AJTS	CONTR 2025 0000350059	Servicios	Publicada	1785075.07	4092124.16	2025-10-08	Delegación Territorial de Justicia, Administración Local y Función Pública en Sevilla	https://www.juntadeandalucia.es/haciendayadministracionpublica/apl/pdc-front-publico/perfiles-licitaciones/detalle-licitacion?idExpediente=840383	79560000-7 Servicios de archivo	Abierto	Electrónica	24 meses	NotFound	2100-12-31	(código NUTS) ES618 - SevillaSevilla	NotFound	Ordinario	CONTRATO DE LOS SERVICIOS PARA EL TRATAMIENTO, GESTIÓN, DEPÓSITO Y CUSTODIA DEL FONDO DOCUMENTAL DEL ARCHIVO JUDICIAL TERRITORIAL DE SEVILLA	and_pliego_prescripciones_333376.pdf	Andalucía	2025-09-29	documentacion, contrato, judicial, empresa, servicio, archivo, adjudicatario, responsable, ajts, organo (1.0)	Tecnológica	tecnologia, datos	limpieza, desinfeccion
ASISTENCIA COMPRA PUBLICA TECNOLOGIA INNOVADORA AIDEA	CONTR 2025 0000451070	Servicios	Publicada	537153.61	537153.61	2025-10-24	Consejería de Sostenibilidad y Medio Ambiente. Secretaría General de Medio Ambiente y Cambio Climático	https://www.juntadeandalucia.es/haciendayadministracionpublica/apl/pdc-front-publico/perfiles-licitaciones/detalle-licitacion?idExpediente=845257	38221000-0 Sistemas de información geográfica (SIG o equivalentes)72820000-4 Servicios de ensayo informático73100000-3 Servicios de investigación y desarrollo experimental73220000-0 Servicios de consultoría en desarrollo90714100-6 Sistemas de información medioambiental	Abierto	Electrónica	33 meses	NotFound	2100-12-31	(código NUTS) ES61 - AndalucíaAlmeríaCórdobaMálagaGranadaJaénHuelvaCádizSevilla	NotFound	Ordinario	ASISTENCIA AL SEGUIMIENTO DEL DESARROLLO TECNOLÓGICO E INNOVADOR, Y A LA EJECUCIÓN DEL PROYECTO DE COMPRA DE TECNOLOGÍA INNOVADORA AIDEA	and_pliego_prescripciones_336898.pdf	Andalucía	2025-09-29	desarrollo, proyecto, servicio, dato, gestion, proceso, verificacion, actividad, innovacion, objetivo (1.0)	Tecnológica	software, tecnologia, big_data, datos, analitica, inteligencia_artificial, machine_learning, etl, cloud, nube, automatizacion	infraestructura
0000853/2025 CONTRATACIÓN DEL SUMINISTRO DE ESTERILIZADOR DE VAPOR (AUTOCLAVE), MEDIANTE PROCEDIMIENTO ABIERTO SIMPLIFICADO Y PRESENTACIÓN ELECTRÓNICA DE OFERTAS PARA EL HOSPITAL VALLE DE LOS PEDROCHES PERTENECIENTE AL ÁREA DE GESTIÓN SANITARIA NORTE DE CÓRDOBA ADSCRITA A LA CENTRAL PROVINCIAL DE COMPRAS DE CÓRDOBA (PAS 45/25)	CONTR 2025 0000605142	Suministros	Publicada	64750.0	64750.0	2025-10-09	Servicio Andaluz de Salud	https://www.juntadeandalucia.es/haciendayadministracionpublica/apl/pdc-front-publico/perfiles-licitaciones/detalle-licitacion?idExpediente=841557	33100000-1 Equipamiento médico	Abierto simplificado	Electrónica	Ver lotes	NotFound	2100-12-31	(código NUTS) ES613 - CórdobaCórdoba	NotFound	Ordinario	CONTRATACIÓN DEL SUMINISTRO DE ESTERILIZADOR DE VAPOR (AUTOCLAVE), MEDIANTE PROCEDIMIENTO ABIERTO SIMPLIFICADO Y PRESENTACIÓN ELECTRÓNICA DE OFERTAS PARA EL HOSPITAL VALLE DE LOS PEDROCHES PERTENECIENTE AL ÁREA DE GESTIÓN SANITARIA NORTE DE CÓRDOBA ADSCRITA A LA CENTRAL PROVINCIAL DE COMPRAS DE CÓRDOBA (PAS 45/25)	and_pliego_prescripciones_335759.pdf	Andalucía	2025-09-29	equipo, ciclo, alto, dimensión, decreto, real, sistema, acero, inoxidable, tecnica (1.0)	N/S		
SERVICIO DE RESTAURACIÓN DE  DE MATERIALES ARQUEOLÓGICOS MUSEO IBERO	CONTR 2025 0000470024	Servicios	Publicada	111570.25	111570.25	2025-10-20	Delegación Territorial de Turismo, Cultura y Deporte en Jaén	https://www.juntadeandalucia.es/haciendayadministracionpublica/apl/pdc-front-publico/perfiles-licitaciones/detalle-licitacion?idExpediente=845236	45454100-5 Trabajos de restauración	Abierto simplificado	Electrónica	Ver lotes	NotFound	2100-12-31	(código NUTS) ES616 - JaénJaén	NotFound	Ordinario	SERVICIO DE RESTAURACIÓN DE  DE MATERIALES ARQUEOLÓGICOS DE LA COLECCIÓN DEL MUSEO IBERO	and_pliego_prescripciones_336848.pdf	Andalucía	2025-09-29	limpieza, eliminacion, reintegracion, repaso, cromatico, adhesivo, ajuste, soporte, cion, capa (1.0)	Tecnológica	analitica	reparacion, limpieza, vestuario
Suministro de productos y utensilios de limpieza para lDT Educación	CONTR 2025 0000484215	Suministros	Publicada	13291.24	47848.47	2025-10-16	Delegación Territorial de Desarrollo Educativo y Formación Profesional y de Universidad, Investigación e Innovación en Cádiz	https://www.juntadeandalucia.es/haciendayadministracionpublica/apl/pdc-front-publico/perfiles-licitaciones/detalle-licitacion?idExpediente=841792	39830000-9 Productos de limpieza	Abierto simplificado abreviado	Electrónica	12 meses	NotFound	2100-12-31	(código NUTS) ES612 - CádizCádiz	NotFound	Ordinario	Suministro de productos y utensilios de limpieza para la Delegación Territorial de Desarrollo Educativo y Formación Profesional, y de Universidad, Investigación e Innovación en Cádiz	and_pliego_prescripciones_336211.pdf	Andalucía	2025-09-29	producto, adjudicatario, litro, contrato, limpiador, unidad, admisible, envase, seguridad, centro (1.0)	No tecnológica		limpieza, desinfeccion, mobiliario
PA 150/2023 (SEVILLA).SERVICIO DE LIMPIEZA, LOGÍSTICA DE GESTIÓN INTERNA DE RESIDUOS, SUMINISTRO Y REPOSICIÓN DEL MATERIAL DE HIGIENE CONSUMIBLE Y OTROS SERVICIOS COMPLEMENTARIOS, CON VALOR SOCIAL Y MEDIOAMBIENTAL DE CENTROS SANITARIOS PERTENECIENTES AL DISTRITO SANITARIO SEVILLA, DISTRITO SANITARIO SEVILLA NORTE-ALJARAFE Y CENTRO DE TRANSFUSION, TEJIDOS Y CELULAS	CONTR 2024 0001122645	Servicios	Publicada	35727279.31	42872735.17	2025-10-10	Servicio Andaluz de Salud	https://www.juntadeandalucia.es/haciendayadministracionpublica/apl/pdc-front-publico/perfiles-licitaciones/detalle-licitacion?idExpediente=837002	90911200-8 Servicios de limpieza de edificios	Abierto	Electrónica	Ver lotes	NotFound	2100-12-31	(código NUTS) ES618 - SevillaSevilla	NotFound	Ordinario	PA 150/2023 SERVICIO DE LIMPIEZA, LOGÍSTICA DE GESTIÓN INTERNA DE RESIDUOS, SUMINISTRO Y REPOSICIÓN DEL MATERIAL DE HIGIENE CONSUMIBLE Y OTROS SERVICIOS COMPLEMENTARIOS, CON VALOR SOCIAL Y MEDIOAMBIENTAL DE CENTROS SANITARIOS PERTENECIENTES AL DISTRITO SANITARIO SEVILLA, DISTRITO SANITARIO SEVILLA NORTE-ALJARAFE Y CENTRO DE TRANSFUSION, TEJIDOS Y CELULAS (SEVILLA).	and_pliego_prescripciones_323966.pdf	Andalucía	2025-09-29	Sin tema	No tecnológica		limpieza
SERVICIO DE REVISIÓN Y MANTENIMIENTO DE PROTECCIÓN CONTRA INCENDIOS Y EXTIN	CONTR 2025 0000449961	Servicios	Publicada	6868.2	20604.61	2025-10-16	Delegación Territorial de Desarrollo Educativo y Formación Profesional y de Universidad, Investigación e Innovación en Cádiz	https://www.juntadeandalucia.es/haciendayadministracionpublica/apl/pdc-front-publico/perfiles-licitaciones/detalle-licitacion?idExpediente=841314	35111300-8 Extintores50413200-5 Servicios de reparación y mantenimiento de instalaciones contra incendios	Abierto simplificado abreviado	Electrónica	24 meses	NotFound	2100-12-31	(código NUTS) ES612 - CádizCádiz	NotFound	Ordinario	SERVICIO DE REVISIÓN Y MANTENIMIENTO DE PROTECCIÓN CONTRA INCENDIOS Y EXTINTORES 2025 - 2027	and_pliego_prescripciones_336228.pdf	Andalucía	2025-09-29	mantenimiento, empresa, incendio, adjudicatario, sistema, proteccion, contrato, equipo, trabajo, instalación (1.0)	No tecnológica		reparacion, limpieza, alimentacion, seguro
