titulo	numero_expediente	tipo_contrato	estado_licitacion	importe_licitacion	valor_estimado_contrato	fecha_limite_presentacion	organo_contratacion	enlace	codigo_cpv	procedimiento_contratacion	forma_presentacion	duracion_contrato	financiacion_ue	fecha_formalizacion	lugar_ejecucion	sistema_contratacion	tramitacion	descripcion	pdf	fuente	fecha_proceso	topicos_lda	clasificacion	palabras_tecnologicas_detectadas	palabras_descartadas_detectadas
Contrato de suministro de equipamiento de uso didáctico para el nuevo centro de formación profesional ifp “instalaciones ismie Vallecas” de la Comunidad de Madrid.	NotFound	Suministros	NotFound	-1.0	-1.0	2100-12-31	NotFound	https://contratos-publicos.comunidad.madrid/contrato-publico/contrato-suministro-equipamiento-uso-didactico-nuevo-centro-formacion-profesional	NotFound	NotFound	NotFound	NotFound	NotFound	2100-12-31	NotFound	NotFound	NotFound	Suministro de equipamiento de uso didáctico para el nuevo centro de formación profesional ifp “instalaciones ismie Vallecas” de la Comunidad de Madrid.	NotFound	Comunidad de Madrid	2025-07-13	Sin tema	N/S		
Servicio de soporte y mantenimiento del software para la gestión, control y trazabilidad de material sanitario y de alto valor en el Hospital General Universitario Gregorio Marañon.	NotFound	Servicios	NotFound	-1.0	118153.2	2100-12-31	NotFound	https://contratos-publicos.comunidad.madrid/contrato-publico/servicio-soporte-mantenimiento-software-gestion-control-trazabilidad-material	NotFound	NotFound	NotFound	NotFound	NotFound	2100-12-31	NotFound	NotFound	NotFound	Servicio de soporte y mantenimiento del software para la gestión, control y trazabilidad de material sanitario y de alto valor en el Hospital General Universitario Gregorio Marañón.	NotFound	Comunidad de Madrid	2025-07-13	Sin tema	Tecnológica	software	
Suministro de licencia de uso en propiedad e implantación de sistemas de gestón clínica integral para el Servicio de Rehabilitación del Hospital Universitario de Getafe	NotFound	Suministros	NotFound	-1.0	-1.0	2100-12-31	NotFound	https://contratos-publicos.comunidad.madrid/contrato-publico/suministro-licencia-uso-propiedad-e-implantacion-sistemas-geston-clinica-integral	NotFound	NotFound	NotFound	NotFound	NotFound	2100-12-31	NotFound	NotFound	NotFound	Suministro de licencia de uso en propiedad e implantación de sistemas de gestón clínica integral para el Servicio de Rehabilitación del Hospital Universitario de Getafe	NotFound	Comunidad de Madrid	2025-07-13	Sin tema	N/S		
Contrato mixto de suministro de la cartelería para la actualización de la señalización y del servicio necesario para su instalación en los centros de la Gerencia Asistencial de Atención Primaria, dependientes del Servicio Madrileño de Salud	NotFound	Suministros	NotFound	-1.0	142076.42	2100-12-31	NotFound	https://contratos-publicos.comunidad.madrid/contrato-publico/contrato-mixto-suministro-carteleria-actualizacion-senalizacion-servicio-necesario	NotFound	NotFound	NotFound	NotFound	NotFound	2100-12-31	NotFound	NotFound	NotFound	Contrato mixto de suministro de la cartelería para la actualización de la señalización y del servicio necesario para su instalación en los centros de la Gerencia Asistencial de Atención Primaria, dependientes del Servicio Madrileño de Salud	NotFound	Comunidad de Madrid	2025-07-13	Sin tema	N/S		
Obra de instalación y puesta en marcha de un sistema de control de accesos en el Hospital Universitario El Escorial	NotFound	Obras	NotFound	-1.0	57850.0	2100-12-31	NotFound	https://contratos-publicos.comunidad.madrid/contrato-publico/obra-instalacion-puesta-marcha-sistema-control-accesos-hospital-universitario	NotFound	NotFound	NotFound	NotFound	NotFound	2100-12-31	NotFound	NotFound	NotFound	Este contrato tiene por objeto la ejecución de la obra de instalación y puesta en marcha de un sistema de control de accesos en el Hospital Universitario El Escorial, cuyas características se especifican en el pliego de prescripciones técnicas particulares.	NotFound	Comunidad de Madrid	2025-07-13	Sin tema	N/S		
Redacción del plan funcional, plan de espacios, plan de dotación y estudio previo arquitectónico que servirá de base para la reforma y ampliación del Hospital Universitario Severo Ochoa	NotFound	Servicios	NotFound	-1.0	139980.06	2100-12-31	NotFound	https://contratos-publicos.comunidad.madrid/contrato-publico/redaccion-plan-funcional-plan-espacios-plan-dotacion-estudio-previo-arquitectonico	NotFound	NotFound	NotFound	NotFound	NotFound	2100-12-31	NotFound	NotFound	NotFound	Redacción del plan funcional, plan de espacios, plan de dotación y estudio previo arquitectónico que servirá de base para la reforma y ampliación del Hospital Universitario Severo Ochoa	NotFound	Comunidad de Madrid	2025-07-13	Sin tema	N/S		
Acompañamiento a menores en los juzgados de la Comunidad de Madrid	NotFound	Servicios	NotFound	-1.0	231667.28	2100-12-31	NotFound	https://contratos-publicos.comunidad.madrid/contrato-publico/acompanamiento-menores-juzgados-comunidad-madrid	NotFound	NotFound	NotFound	NotFound	NotFound	2100-12-31	NotFound	NotFound	NotFound	Acompañamiento a menores en los juzgados de la Comunidad de Madrid.	NotFound	Comunidad de Madrid	2025-07-13	Sin tema	N/S		
Planifica Madrid, Proyectos y Obras, M.P., S.A. ED-AS-0022-2025-O Obras de reubicación del centro de transformación, centro de seccionamiento, grupo generador y líneas interiores en la parcela B3, necesario para la ejecución del proyecto de rehabilitación y ampliación del Pabellón de Damas en c/ Doctor Castelo nº 44 C/V c/Doctor Esquerdo, en Madrid.	NotFound	Obras	NotFound	-1.0	369711.0	2100-12-31	NotFound	https://contratos-publicos.comunidad.madrid/contrato-publico/planifica-madrid-proyectos-obras-mp-sa-ed-as-0022-2025-o-obras-reubicacion-centro	NotFound	NotFound	NotFound	NotFound	NotFound	2100-12-31	NotFound	NotFound	NotFound	a. Tipo: Obras b. Descripción: Obras de reubicación del centro de transformación, centro de seccionamiento, grupo generador y líneas interiores en la parcela B3, necesario para la ejecución del proyecto de rehabilitación y ampliación del Pabellón de Damas. c. Situación: Calle Doctor Castelo nº 44 C/V Calle Doctor Doctor Esquerdo, en Madrid. d. División por lotes: No. e. Plazo de ejecución del contrato: Seis (6) meses computados desde el día siguiente a la firma del acta de inicio de ejecución de las obras. f. Prórrogas. No.	NotFound	Comunidad de Madrid	2025-07-13	Sin tema	No tecnológica		obras
Suministro de un congelador biológico para el Centro de Transfusión de la Comunidad de Madrid	NotFound	Suministros	NotFound	-1.0	18200.0	2100-12-31	NotFound	https://contratos-publicos.comunidad.madrid/contrato-publico/suministro-congelador-biologico-centro-transfusion-comunidad-madrid	NotFound	NotFound	NotFound	NotFound	NotFound	2100-12-31	NotFound	NotFound	NotFound	Suministro de un congelador biológico para el Centro de Transfusión de la Comunidad de Madrid	NotFound	Comunidad de Madrid	2025-07-13	Sin tema	N/S		
Servicios de montaje y desmontaje de la exposición Juan Pérez Agirregoikoa: guerra, comercio y filantropía en el Museo Centro De Arte Dos De Mayo (MCA2M)	NotFound	Servicios	NotFound	-1.0	66681.58	2100-12-31	NotFound	https://contratos-publicos.comunidad.madrid/contrato-publico/servicios-montaje-desmontaje-exposicion-juan-perez-agirregoikoa-guerra-comercio	NotFound	NotFound	NotFound	NotFound	NotFound	2100-12-31	NotFound	NotFound	NotFound	Servicios necesarios para la adecuada ejecución de la exposición “Juan Pérez Agirregoikoa: guerra, comercio y filantropía”	NotFound	Comunidad de Madrid	2025-07-13	Sin tema	N/S		
Servicio de retribución flexible de la Fundación de la Energía de la Comunidad de Madrid	NotFound	Servicios	NotFound	-1.0	30885.12	2100-12-31	NotFound	https://contratos-publicos.comunidad.madrid/contrato-publico/servicio-retribucion-flexible-fundacion-energia-comunidad-madrid	NotFound	NotFound	NotFound	NotFound	NotFound	2100-12-31	NotFound	NotFound	NotFound	servicio de retribución flexible de su plantilla. El servicio a prestar incluye la implementación para los trabajadores de la Fundación con el fin de ofrecerles una alternativa voluntaria que les permita optimizar su salario neto mediante la adquisición de determinados productos o servicios exentos total o parcialmente de tributación, conforme a la normativa vigente	NotFound	Comunidad de Madrid	2025-07-13	Sin tema	N/S		
Suministro de suscripción de licencias de la familia de Software Creative Adobe	NotFound	Suministros	NotFound	-1.0	50246.46	2100-12-31	NotFound	https://contratos-publicos.comunidad.madrid/contrato-publico/suministro-suscripcion-licencias-familia-software-creative-adobe	NotFound	NotFound	NotFound	NotFound	NotFound	2100-12-31	NotFound	NotFound	NotFound	Suministro de suscripción de licencias de la familia de Software Creative Adobe	NotFound	Comunidad de Madrid	2025-07-13	Sin tema	Tecnológica	software	
Servicios docentes sobre competencias clínicas en un entorno virtual de aprendizaje (plataforma online) para los profesionales de la Gerencia Asistencial de Atención Primaria del Servicio Madrileño de Salud	NotFound	Servicios	NotFound	-1.0	49555.0	2100-12-31	NotFound	https://contratos-publicos.comunidad.madrid/contrato-publico/servicios-docentes-competencias-clinicas-entorno-virtual-aprendizaje-plataforma	NotFound	NotFound	NotFound	NotFound	NotFound	2100-12-31	NotFound	NotFound	NotFound	Servicios docentes sobre competencias clínicas en un entorno virtual de aprendizaje (plataforma online) para los profesionales de la Gerencia Asistencial de Atención Primaria del Servicio Madrileño de Salud	NotFound	Comunidad de Madrid	2025-07-13	Sin tema	N/S		
Servicio de mantenimiento, soporte y suscripciones de software de dos equipos para la protección ante ataques de denegación de servicios (DoS), para Metro de Madrid	NotFound	Servicios	NotFound	-1.0	189117.52	2100-12-31	NotFound	https://contratos-publicos.comunidad.madrid/contrato-publico/servicio-mantenimiento-soporte-suscripciones-software-dos-equipos-proteccion	NotFound	NotFound	NotFound	NotFound	NotFound	2100-12-31	NotFound	NotFound	NotFound	Servicio de mantenimiento, soporte y suscripciones de software de dos equipos para la protección ante ataques de denegación de servicios (DoS), para Metro de Madrid	NotFound	Comunidad de Madrid	2025-07-13	Sin tema	Tecnológica	software	
Soporte y mantenimiento de productos ILOG de IBM	NotFound	Suministros	NotFound	-1.0	185861.58	2100-12-31	NotFound	https://contratos-publicos.comunidad.madrid/contrato-publico/soporte-mantenimiento-productos-ilog-ibm	NotFound	NotFound	NotFound	NotFound	NotFound	2100-12-31	NotFound	NotFound	NotFound	Soporte y mantenimiento de los productos ILOG de IBM	NotFound	Comunidad de Madrid	2025-07-13	Sin tema	N/S		
Servicio de soporte técnico para Gestión de Centros y Sistemas de Seguridad de Metro de Madrid	NotFound	Servicios	NotFound	-1.0	300000.0	2100-12-31	NotFound	https://contratos-publicos.comunidad.madrid/contrato-publico/servicio-soporte-tecnico-gestion-centros-sistemas-seguridad-metro-madrid	NotFound	NotFound	NotFound	NotFound	NotFound	2100-12-31	NotFound	NotFound	NotFound	Servicio de soporte técnico para Gestión de Centros y Sistemas de Seguridad de Metro de Madrid	NotFound	Comunidad de Madrid	2025-07-13	Sin tema	N/S		
Soporte y mantenimiento de licencias del software Document For Invoices, para Metro de Madrid	NotFound	Suministros	NotFound	-1.0	74440.0	2100-12-31	NotFound	https://contratos-publicos.comunidad.madrid/contrato-publico/soporte-mantenimiento-licencias-software-document-for-invoices-metro-madrid	NotFound	NotFound	NotFound	NotFound	NotFound	2100-12-31	NotFound	NotFound	NotFound	Soporte y mantenimiento de licencias del software Document For Invoices, para Metro de Madrid	NotFound	Comunidad de Madrid	2025-07-13	Sin tema	Tecnológica	software	
